Places,Weather,Occasion,General,Pickup_Lines
Home,Cold,Christmas,Hey,"You can take me home tonight, but only if Yuletide-y up your place."
North Pole,Cold,Christmas,hello,Are you interested in seeing the "North Pole"?
Bowling,Warm,Gaming,hi,"They say bowling is 90 percent mental. I guess I'll have to quit then, because my mind is 100 percent on you."
Starbucks,Warm,None,Wassup?,I'm pretty sure the last 10 books I've read have all been in coffee shops. I don't even know if I'm literate at home anymore.
North Pole,Cold,Gaming,Heya,So Good to see you.
Bowling,Cold,Gaming,Hey,What a great day!
